{
  "contracts": [
    {
      "name": "ProtocolSettlement",
      "category": "core",
      "source": "src/ProtocolSettlement.sol",
      "artifact": "out/ProtocolSettlement.sol/ProtocolSettlement.json",
      "reference_doc": "docs/reference/protocol-settlement.md",
      "abi_path": "docs/generated/contracts/ProtocolSettlement.abi.json",
      "functions": [
        "accrueDeveloperForExpression",
        "burnPlayerWager",
        "catalog",
        "developerRewards",
        "expressionRegistry",
        "mintPlayerReward",
        "token"
      ],
      "events": [
        "DeveloperAccrualRecorded",
        "PlayerRewardMinted",
        "PlayerWagerBurned"
      ]
    },
    {
      "name": "GameCatalog",
      "category": "core",
      "source": "src/GameCatalog.sol",
      "artifact": "out/GameCatalog.sol/GameCatalog.json",
      "reference_doc": "docs/reference/game-catalog.md",
      "abi_path": "docs/generated/contracts/GameCatalog.abi.json",
      "functions": [
        "getModule",
        "getModuleByController",
        "getModuleByEngine",
        "isAuthorizedControllerForEngine",
        "isLaunchableController",
        "isLaunchableEngine",
        "isSettlableController",
        "isSettlableEngine",
        "registerModule",
        "setModuleStatus"
      ],
      "events": [
        "ModuleRegistered",
        "ModuleStatusUpdated"
      ]
    },
    {
      "name": "GameDeploymentFactory",
      "category": "core",
      "source": "src/GameDeploymentFactory.sol",
      "artifact": "out/GameDeploymentFactory.sol/GameDeploymentFactory.json",
      "reference_doc": "docs/reference/game-deployment-factory.md",
      "abi_path": "docs/generated/contracts/GameDeploymentFactory.abi.json",
      "functions": [
        "catalog",
        "deployPvPModule",
        "deploySoloModule",
        "deployTournamentModule",
        "settlement"
      ],
      "events": [
        "ModuleDeployed"
      ]
    },
    {
      "name": "DeveloperExpressionRegistry",
      "category": "economics",
      "source": "src/DeveloperExpressionRegistry.sol",
      "artifact": "out/DeveloperExpressionRegistry.sol/DeveloperExpressionRegistry.json",
      "reference_doc": "docs/reference/developer-expression-registry.md",
      "abi_path": "docs/generated/contracts/DeveloperExpressionRegistry.abi.json",
      "functions": [
        "getExpressionMetadata",
        "isExpressionCompatible",
        "mintExpression",
        "setExpressionActive",
        "supportsInterface"
      ],
      "events": [
        "ExpressionActiveSet",
        "ExpressionMinted"
      ]
    },
    {
      "name": "DeveloperRewards",
      "category": "economics",
      "source": "src/DeveloperRewards.sol",
      "artifact": "out/DeveloperRewards.sol/DeveloperRewards.json",
      "reference_doc": "docs/reference/developer-rewards.md",
      "abi_path": "docs/generated/contracts/DeveloperRewards.abi.json",
      "functions": [
        "accrue",
        "claim",
        "closeCurrentEpoch",
        "setEpochDuration",
        "token"
      ],
      "events": [
        "DeveloperAccrued",
        "DeveloperClaimed",
        "EpochClosed"
      ]
    },
    {
      "name": "ScuroToken",
      "category": "economics",
      "source": "src/ScuroToken.sol",
      "artifact": "out/ScuroToken.sol/ScuroToken.json",
      "reference_doc": "docs/reference/scuro-token.md",
      "abi_path": "docs/generated/contracts/ScuroToken.abi.json",
      "functions": [
        "mint",
        "nonces"
      ],
      "events": [

      ]
    },
    {
      "name": "ScuroStakingToken",
      "category": "economics",
      "source": "src/ScuroStakingToken.sol",
      "artifact": "out/ScuroStakingToken.sol/ScuroStakingToken.json",
      "reference_doc": "docs/reference/scuro-staking-token.md",
      "abi_path": "docs/generated/contracts/ScuroStakingToken.abi.json",
      "functions": [
        "asset",
        "nonces",
        "stake",
        "unstake"
      ],
      "events": [

      ]
    },
    {
      "name": "ScuroGovernor",
      "category": "governance",
      "source": "src/ScuroGovernor.sol",
      "artifact": "out/ScuroGovernor.sol/ScuroGovernor.json",
      "reference_doc": "docs/reference/scuro-governor.md",
      "abi_path": "docs/generated/contracts/ScuroGovernor.abi.json",
      "functions": [
        "proposalNeedsQueuing",
        "proposalThreshold",
        "quorum",
        "state",
        "votingDelay",
        "votingPeriod"
      ],
      "events": [

      ]
    },
    {
      "name": "NumberPickerAdapter",
      "category": "controller",
      "source": "src/controllers/NumberPickerAdapter.sol",
      "artifact": "out/NumberPickerAdapter.sol/NumberPickerAdapter.json",
      "reference_doc": "docs/reference/number-picker-adapter.md",
      "abi_path": "docs/generated/contracts/NumberPickerAdapter.abi.json",
      "functions": [
        "engine",
        "finalize",
        "play",
        "requestExpressionTokenId",
        "requestSettled"
      ],
      "events": [
        "PlayFinalized"
      ]
    },
    {
      "name": "TournamentController",
      "category": "controller",
      "source": "src/controllers/TournamentController.sol",
      "artifact": "out/TournamentController.sol/TournamentController.json",
      "reference_doc": "docs/reference/tournament-controller.md",
      "abi_path": "docs/generated/contracts/TournamentController.abi.json",
      "functions": [
        "catalog",
        "createTournament",
        "engine",
        "reportOutcome",
        "setTournamentActive",
        "settlement",
        "startGameForPlayers"
      ],
      "events": [
        "GameSettled",
        "GameStarted",
        "TournamentActiveSet",
        "TournamentCreated"
      ]
    },
    {
      "name": "PvPController",
      "category": "controller",
      "source": "src/controllers/PvPController.sol",
      "artifact": "out/PvPController.sol/PvPController.json",
      "reference_doc": "docs/reference/pvp-controller.md",
      "abi_path": "docs/generated/contracts/PvPController.abi.json",
      "functions": [
        "catalog",
        "createSession",
        "engine",
        "settleSession",
        "settlement"
      ],
      "events": [
        "SessionCreated",
        "SessionSettled"
      ]
    },
    {
      "name": "BlackjackController",
      "category": "controller",
      "source": "src/controllers/BlackjackController.sol",
      "artifact": "out/BlackjackController.sol/BlackjackController.json",
      "reference_doc": "docs/reference/blackjack-controller.md",
      "abi_path": "docs/generated/contracts/BlackjackController.abi.json",
      "functions": [
        "claimPlayerTimeout",
        "doubleDown",
        "engine",
        "hit",
        "sessionExpressionTokenId",
        "sessionSettled",
        "settle",
        "split",
        "stand",
        "startHand"
      ],
      "events": [
        "HandStarted",
        "SessionSettled"
      ]
    },
    {
      "name": "NumberPickerEngine",
      "category": "engine",
      "source": "src/engines/NumberPickerEngine.sol",
      "artifact": "out/NumberPickerEngine.sol/NumberPickerEngine.json",
      "reference_doc": "docs/reference/number-picker-engine.md",
      "abi_path": "docs/generated/contracts/NumberPickerEngine.abi.json",
      "functions": [
        "catalog",
        "engineType",
        "getOutcome",
        "getSettlementOutcome",
        "rawFulfillRandomWords",
        "requestPlay"
      ],
      "events": [
        "PlayRequested",
        "PlayResolved"
      ]
    },
    {
      "name": "SingleDeckBlackjackEngine",
      "category": "engine",
      "source": "src/engines/SingleDeckBlackjackEngine.sol",
      "artifact": "out/SingleDeckBlackjackEngine.sol/SingleDeckBlackjackEngine.json",
      "reference_doc": "docs/reference/single-deck-blackjack-engine.md",
      "abi_path": "docs/generated/contracts/SingleDeckBlackjackEngine.abi.json",
      "functions": [
        "catalog",
        "claimPlayerTimeout",
        "declareAction",
        "engineType",
        "getSession",
        "getSettlementOutcome",
        "openSession",
        "requiredAdditionalBurn",
        "submitActionProof",
        "submitInitialDealProof",
        "submitShowdownProof"
      ],
      "events": [
        "ActionDeclared",
        "ActionResolved",
        "InitialDealResolved",
        "PlayerTimeoutClaimed",
        "SessionOpened",
        "ShowdownResolved"
      ]
    },
    {
      "name": "SingleDraw2To7Engine",
      "category": "engine",
      "source": "src/engines/SingleDraw2To7Engine.sol",
      "artifact": "out/SingleDraw2To7Engine.sol/SingleDraw2To7Engine.json",
      "reference_doc": "docs/reference/single-draw-2-7-engine.md",
      "abi_path": "docs/generated/contracts/SingleDraw2To7Engine.abi.json",
      "functions": [
        "bet",
        "catalog",
        "claimTimeout",
        "declareDraw",
        "engineType",
        "fold",
        "getCurrentPhase",
        "getHandState",
        "getOutcomes",
        "getProofDeadline",
        "handleTimeout",
        "initializeGame",
        "isGameOver",
        "submitDrawProof",
        "submitInitialDealProof",
        "submitShowdownProof"
      ],
      "events": [
        "DrawDeclared",
        "DrawResolved",
        "HandAwaitingInitialDeal",
        "PublicActionTaken",
        "ShowdownSubmitted"
      ]
    },
    {
      "name": "PokerVerifierBundle",
      "category": "verifier",
      "source": "src/verifiers/PokerVerifierBundle.sol",
      "artifact": "out/PokerVerifierBundle.sol/PokerVerifierBundle.json",
      "reference_doc": "docs/reference/poker-verifier-bundle.md",
      "abi_path": "docs/generated/contracts/PokerVerifierBundle.abi.json",
      "functions": [
        "setVerifiers",
        "verifyDraw",
        "verifyInitialDeal",
        "verifyShowdown"
      ],
      "events": [

      ]
    },
    {
      "name": "BlackjackVerifierBundle",